{
  "schemaVersion": 1,
  "id": "fjordfall/ui/field-paper",
  "name": "Field Paper",
  "kind": "artwork",
  "collection": "fjordfall",
  "category": "UI & illustration",
  "description": "Fine warm-white field-guide paper texture for map sheets and readable interface backgrounds.",
  "tags": [
    "artwork",
    "fjordfall",
    "ui-illustration",
    "field",
    "paper"
  ],
  "creator": {
    "name": "Jonathan Maddison",
    "url": "https://github.com/jonathanwmaddison"
  },
  "license": "CC-BY-4.0",
  "attribution": "Field Paper by Jonathan Maddison, Generated Assets (CC-BY-4.0).",
  "file": "assets/fjordfall/ui/field-paper.webp",
  "source": {
    "method": "ai-generated",
    "generator": "OpenAI image generation",
    "description": "OpenAI-generated; recorded model: gpt-image-2.5-sunburst-2026-09-08"
  },
  "usage": {
    "notes": [
      "Use as an image asset; interface behavior is not included."
    ]
  }
}
