{
  "schemaVersion": 1,
  "id": "fjordfall/models/rasteplass_gravel",
  "name": "Rasteplass Gravel",
  "kind": "model",
  "collection": "fjordfall",
  "category": "Props",
  "description": "Rasteplass Gravel, a stylized environment prop from Fjordfall’s Norwegian landscape. Authored in Blender with simple game-scale forms. Game collision and interactive behavior are separate.",
  "tags": [
    "model",
    "fjordfall",
    "props",
    "rasteplass",
    "gravel",
    "stylized"
  ],
  "creator": {
    "name": "Jonathan Maddison",
    "url": "https://github.com/jonathanwmaddison"
  },
  "license": "CC-BY-4.0",
  "attribution": "Rasteplass Gravel by Jonathan Maddison, Generated Assets (CC-BY-4.0).",
  "file": "assets/fjordfall/models/rasteplass_gravel.glb",
  "preview": "thumbnails/fjordfall-rasteplass_gravel.glb.png",
  "source": {
    "method": "authored",
    "generator": "Blender",
    "description": "Authored in Blender 5.2 by the recipe, vertex-coloured, flat-shaded, metres, Y-up"
  },
  "usage": {
    "notes": [
      "Geometry and materials only; game collision and behavior are not included."
    ],
    "units": "metres",
    "upAxis": "Y",
    "scaleVerified": false
  }
}
