{
  "schemaVersion": 1,
  "id": "fjordfall/models/board",
  "name": "Board",
  "kind": "model",
  "collection": "fjordfall",
  "category": "Boats & vehicles",
  "description": "Standalone downhill skateboard model for rider scenes and equipment displays; character hand and foot constraints are not included.",
  "tags": [
    "model",
    "fjordfall",
    "boats-vehicles",
    "board",
    "stylized"
  ],
  "creator": {
    "name": "Jonathan Maddison",
    "url": "https://github.com/jonathanwmaddison"
  },
  "license": "CC-BY-4.0",
  "attribution": "Board by Jonathan Maddison, Generated Assets (CC-BY-4.0). Model created with Meshy.",
  "file": "assets/fjordfall/models/board.glb",
  "preview": "thumbnails/fjordfall-board.glb.png",
  "source": {
    "method": "ai-generated",
    "generator": "Meshy",
    "description": "Meshy-generated model; project asset manifest and credits"
  },
  "usage": {
    "notes": [
      "Geometry and materials only; game collision and behavior are not included."
    ],
    "units": "metres",
    "upAxis": "Y",
    "scaleVerified": false
  }
}
