{
  "schemaVersion": 1,
  "id": "fjordfall/models/winter_birch",
  "name": "Winter Birch",
  "kind": "model",
  "collection": "fjordfall",
  "category": "Vegetation",
  "description": "Winter Birch, a stylized vegetation model from Fjordfall’s Norwegian landscape. Authored in Blender with simple game-scale forms. Game collision and interactive behavior are separate.",
  "tags": [
    "model",
    "fjordfall",
    "vegetation",
    "winter",
    "birch",
    "stylized",
    "nature"
  ],
  "creator": {
    "name": "Jonathan Maddison",
    "url": "https://github.com/jonathanwmaddison"
  },
  "license": "CC-BY-4.0",
  "attribution": "Winter Birch by Jonathan Maddison, Generated Assets (CC-BY-4.0).",
  "file": "assets/fjordfall/models/winter_birch.glb",
  "preview": "thumbnails/fjordfall-winter_birch.glb.png",
  "source": {
    "method": "authored",
    "generator": "Blender",
    "description": "Authored in Blender 5.2 by the recipe, vertex-coloured, flat-shaded, metres, Y-up"
  },
  "usage": {
    "notes": [
      "Geometry and materials only; game collision and behavior are not included."
    ],
    "units": "metres",
    "upAxis": "Y",
    "scaleVerified": false
  }
}
