{
  "schemaVersion": 1,
  "id": "fjordfall/models/hare_sitting",
  "name": "Hare Sitting",
  "kind": "model",
  "collection": "fjordfall",
  "category": "Wildlife",
  "description": "Hare Sitting, a stylized wildlife model from Fjordfall’s Norwegian landscape. Authored in Blender with simple game-scale forms. Game collision and interactive behavior are separate.",
  "tags": [
    "model",
    "fjordfall",
    "wildlife",
    "hare",
    "sitting",
    "stylized"
  ],
  "creator": {
    "name": "Jonathan Maddison",
    "url": "https://github.com/jonathanwmaddison"
  },
  "license": "CC-BY-4.0",
  "attribution": "Hare Sitting by Jonathan Maddison, Generated Assets (CC-BY-4.0).",
  "file": "assets/fjordfall/models/hare_sitting.glb",
  "preview": "thumbnails/fjordfall-hare_sitting.glb.png",
  "source": {
    "method": "authored",
    "generator": "Blender",
    "description": "Authored in Blender 5.2 by the recipe, vertex-coloured, flat-shaded, metres, Y-up"
  },
  "usage": {
    "notes": [
      "Geometry and materials only; game collision and behavior are not included."
    ],
    "units": "metres",
    "upAxis": "Y",
    "scaleVerified": false
  }
}
