{
  "schemaVersion": 1,
  "id": "fjordfall/models/sheep",
  "name": "Sheep",
  "kind": "model",
  "collection": "fjordfall",
  "category": "Wildlife",
  "description": "Sheep, a stylized wildlife model from Fjordfall’s Norwegian landscape. Includes the source model’s embedded surface appearance. Game collision and interactive behavior are separate.",
  "tags": [
    "model",
    "fjordfall",
    "wildlife",
    "sheep",
    "stylized"
  ],
  "creator": {
    "name": "Jonathan Maddison",
    "url": "https://github.com/jonathanwmaddison"
  },
  "license": "CC-BY-4.0",
  "attribution": "Sheep by Jonathan Maddison, Generated Assets (CC-BY-4.0). Model created with Meshy.",
  "file": "assets/fjordfall/models/sheep.glb",
  "preview": "thumbnails/fjordfall-sheep.glb.png",
  "source": {
    "method": "ai-generated",
    "generator": "Meshy",
    "description": "Meshy-generated model; project asset manifest and credits"
  },
  "usage": {
    "notes": [
      "Geometry and materials only; game collision and behavior are not included."
    ],
    "units": "metres",
    "upAxis": "Y",
    "scaleVerified": false
  }
}
