{
  "schemaVersion": 1,
  "id": "fjordfall/tex/gravel",
  "name": "Gravel",
  "kind": "texture",
  "collection": "fjordfall",
  "category": "Surface materials",
  "description": "Gravel surface albedo for road shoulders and unpaved ground.",
  "tags": [
    "texture",
    "fjordfall",
    "surface-materials",
    "gravel"
  ],
  "creator": {
    "name": "Jonathan Maddison",
    "url": "https://github.com/jonathanwmaddison"
  },
  "license": "CC-BY-4.0",
  "attribution": "Gravel by Jonathan Maddison, Generated Assets (CC-BY-4.0).",
  "file": "assets/fjordfall/tex/gravel.webp",
  "source": {
    "method": "ai-generated",
    "generator": "OpenAI image generation",
    "description": "OpenAI-generated; recorded model: gpt-image-2.5-sunburst-2026-09-08"
  },
  "usage": {
    "notes": [
      "Inspect seams and color response in your target engine."
    ],
    "seamlessVerified": false
  }
}
