{
  "schemaVersion": 1,
  "id": "fjordfall/ui/mark-eiders",
  "name": "Mark Eiders",
  "kind": "artwork",
  "collection": "fjordfall",
  "category": "UI & illustration",
  "description": "Illustrated eiders journey mark from Fjordfall’s field-guide interface. A small raster emblem for badges, journals and discovery lists.",
  "tags": [
    "artwork",
    "fjordfall",
    "ui-illustration",
    "mark",
    "eiders"
  ],
  "creator": {
    "name": "Jonathan Maddison",
    "url": "https://github.com/jonathanwmaddison"
  },
  "license": "CC-BY-4.0",
  "attribution": "Mark Eiders by Jonathan Maddison, Generated Assets (CC-BY-4.0).",
  "file": "assets/fjordfall/ui/mark-eiders.webp",
  "source": {
    "method": "ai-generated",
    "generator": "OpenAI image generation",
    "description": "OpenAI-generated; recorded model: gpt-image-2.5-sunburst-2026-09-08"
  },
  "usage": {
    "notes": [
      "Use as an image asset; interface behavior is not included."
    ]
  }
}
