{
  "schemaVersion": 1,
  "id": "fjordfall/models/wheel_lo",
  "name": "Wheel Lo",
  "kind": "model",
  "collection": "fjordfall",
  "category": "Boats & vehicles",
  "description": "Wheel Lo, a stylized boats & vehicles asset from Fjordfall’s Norwegian landscape. Includes the source model’s embedded surface appearance. Game collision and interactive behavior are separate.",
  "tags": [
    "model",
    "fjordfall",
    "boats-vehicles",
    "wheel",
    "lo",
    "stylized"
  ],
  "creator": {
    "name": "Jonathan Maddison",
    "url": "https://github.com/jonathanwmaddison"
  },
  "license": "CC-BY-4.0",
  "attribution": "Wheel Lo by Jonathan Maddison, Generated Assets (CC-BY-4.0). Model created with Meshy.",
  "file": "assets/fjordfall/models/wheel_lo.glb",
  "preview": "thumbnails/fjordfall-wheel_lo.glb.png",
  "source": {
    "method": "ai-generated",
    "generator": "Meshy",
    "description": "Meshy-generated model; project asset manifest and credits"
  },
  "usage": {
    "notes": [
      "Geometry and materials only; game collision and behavior are not included."
    ],
    "units": "metres",
    "upAxis": "Y",
    "scaleVerified": false
  }
}
