{
  "schemaVersion": 1,
  "id": "fjordfall/tex/snow",
  "name": "Snow",
  "kind": "texture",
  "collection": "fjordfall",
  "category": "Surface materials",
  "description": "Fine, softly lit snow albedo detail for terrain surfaces; intended to be combined with engine lighting.",
  "tags": [
    "texture",
    "fjordfall",
    "surface-materials",
    "snow"
  ],
  "creator": {
    "name": "Jonathan Maddison",
    "url": "https://github.com/jonathanwmaddison"
  },
  "license": "CC-BY-4.0",
  "attribution": "Snow by Jonathan Maddison, Generated Assets (CC-BY-4.0).",
  "file": "assets/fjordfall/tex/snow.webp",
  "source": {
    "method": "ai-generated",
    "generator": "OpenAI image generation",
    "description": "OpenAI-generated; recorded model: gpt-image-2.5-sunburst-2026-09-08"
  },
  "usage": {
    "notes": [
      "Inspect seams and color response in your target engine."
    ],
    "seamlessVerified": false
  }
}
