{
  "schemaVersion": 1,
  "id": "fjordfall/models/sign_rein",
  "name": "Sign Rein",
  "kind": "model",
  "collection": "fjordfall",
  "category": "Road & infrastructure",
  "description": "Sign Rein, a stylized road & infrastructure asset from Fjordfall’s Norwegian landscape. Authored in Blender with simple game-scale forms. Game collision and interactive behavior are separate.",
  "tags": [
    "model",
    "fjordfall",
    "road-infrastructure",
    "sign",
    "rein",
    "stylized"
  ],
  "creator": {
    "name": "Jonathan Maddison",
    "url": "https://github.com/jonathanwmaddison"
  },
  "license": "CC-BY-4.0",
  "attribution": "Sign Rein by Jonathan Maddison, Generated Assets (CC-BY-4.0).",
  "file": "assets/fjordfall/models/sign_rein.glb",
  "preview": "thumbnails/fjordfall-sign_rein.glb.png",
  "source": {
    "method": "authored",
    "generator": "Blender",
    "description": "Authored in Blender 5.2 by the recipe, vertex-coloured, flat-shaded, metres, Y-up"
  },
  "usage": {
    "notes": [
      "Geometry and materials only; game collision and behavior are not included."
    ],
    "units": "metres",
    "upAxis": "Y",
    "scaleVerified": false
  }
}
