{
  "schemaVersion": 1,
  "id": "fjordfall/models/kayak_hull",
  "name": "Kayak Hull",
  "kind": "model",
  "collection": "fjordfall",
  "category": "Boats & vehicles",
  "description": "Kayak Hull, a stylized boats & vehicles asset from Fjordfall’s Norwegian landscape. Authored in Blender with simple game-scale forms. Game collision and interactive behavior are separate.",
  "tags": [
    "model",
    "fjordfall",
    "boats-vehicles",
    "kayak",
    "hull",
    "stylized"
  ],
  "creator": {
    "name": "Jonathan Maddison",
    "url": "https://github.com/jonathanwmaddison"
  },
  "license": "CC-BY-4.0",
  "attribution": "Kayak Hull by Jonathan Maddison, Generated Assets (CC-BY-4.0).",
  "file": "assets/fjordfall/models/kayak_hull.glb",
  "preview": "thumbnails/fjordfall-kayak_hull.glb.png",
  "source": {
    "method": "authored",
    "generator": "Blender",
    "description": "Authored in Blender 5.2 by the recipe, vertex-coloured, flat-shaded, metres, Y-up"
  },
  "usage": {
    "notes": [
      "Geometry and materials only; game collision and behavior are not included."
    ],
    "units": "metres",
    "upAxis": "Y",
    "scaleVerified": false
  }
}
