{
  "schemaVersion": 1,
  "id": "fjordfall/tex/rock-512",
  "name": "Rock 512",
  "kind": "texture",
  "collection": "fjordfall",
  "category": "Surface materials",
  "description": "Flat-lit bedrock surface detail for cliffs and rocky terrain. This is a color texture, not a displacement or normal map. This is the 512-pixel mobile variant.",
  "tags": [
    "texture",
    "fjordfall",
    "surface-materials",
    "rock"
  ],
  "creator": {
    "name": "Jonathan Maddison",
    "url": "https://github.com/jonathanwmaddison"
  },
  "license": "CC-BY-4.0",
  "attribution": "Rock 512 by Jonathan Maddison, Generated Assets (CC-BY-4.0).",
  "file": "assets/fjordfall/tex/rock-512.webp",
  "source": {
    "method": "ai-generated",
    "generator": "OpenAI image generation",
    "description": "OpenAI-generated; project asset manifest; phone variants resized from full-size images"
  },
  "usage": {
    "notes": [
      "Inspect seams and color response in your target engine."
    ],
    "seamlessVerified": false
  }
}
